{
  "id": 7870,
  "title": "SIP-7870: Hardware and Bandwidth Recommendations",
  "status": "Living",
  "description": "System recommendations for Validators and Full nodes",
  "author": "Parithosh Jayanthi (@parithosh), Kevaundray Wedderburn (@kevaundray), Josh Rudolf (@jrudolf), Dankrad Feist (@dankrad), Justin Traglia (@jtraglia), Ignacio Hagopian (@jsign), George Kadianakis (@asn-d6), Fredrik Svantes (@fredriksvantes), Carl Beekhuizen (@carlbeek), Toni Wahrstätter (@nerolation)",
  "type": "Informational",
  "createdDate": "2025-01-26",
  "discussionLink": "https://sila-magicians.org/t/hardware-and-bandwidth-recommendations-for-full-nodes-and-validators/22675",
  "forkRelationships": [],
  "tradeoffs": null
}
