{
  "id": 8365,
  "title": "SIP-8365: BLS withdrawal credential retirement",
  "status": "Draft",
  "description": "Exit validators with 0x00 withdrawal credentials and stop creating new ones, keeping the credential change path open",
  "author": "NC (@ensi321)",
  "type": "Standards Track",
  "category": "Core",
  "createdDate": "2026-07-18",
  "discussionLink": "https://sila-magicians.org/t/sip-8365-bls-withdrawal-credential-retirement/29284",
  "requires": [
    6110,
    7251,
    7732
  ],
  "pendingPullRequest": {
    "number": 12097,
    "url": "https://github.com/sila-chain/SIPs/pull/12097"
  },
  "reviewer": "bot",
  "layer": "CL",
  "forkRelationships": [
    {
      "forkName": "Hegota",
      "statusHistory": [
        {
          "status": "Proposed",
          "call": "acdc/184",
          "date": "2026-08-06"
        }
      ],
      "champions": [
        {
          "name": "NC"
        }
      ]
    }
  ],
  "laymanDescription": "About 9,000 validators still use the original genesis-era withdrawal format, which has no execution address, so nobody can exit them if the key is lost. This proposal exits every one of them and stops new ones being created, while leaving the path to convert credentials open.",
  "benefits": [
    "Every future fork stops carrying the credential-change operation, its gossip topic, and pool",
    "Balances stay recoverable in full at any time by rotating to execution credentials",
    "Post-quantum key registry designs no longer need a path for validators with no execution address"
  ],
  "tradeoffs": [
    "Holders of only a signing key can exit but cannot rotate, so they stay stranded",
    "Retirement shares the exit queue with ordinary voluntary exits during the drain window",
    "Deposits creating new validators of this type are silently skipped and the sila is unrecoverable"
  ]
}
