{
  "id": 649,
  "title": "SIP-649: Metropolis Difficulty Bomb Delay and Block Reward Reduction",
  "status": "Final",
  "description": "",
  "author": "Afri Schoedon (@5chdn), Vitalik Buterin (@vbuterin)",
  "type": "Standards Track",
  "category": "Core",
  "createdDate": "2017-06-21",
  "discussionLink": "https://github.com/sila-chain/SIPs/issues/649",
  "forkRelationships": [],
  "tradeoffs": null
}
