{
  "id": 8347,
  "title": "SIP-8347: Offline State Migration to the PBT",
  "status": "Draft",
  "description": "Convert state to the PBT off the consensus-critical path, distribute a verifiable snapshot, and swap the commitment at a single fork",
  "author": "Carlos Perez (@CPerezz), Maria Silva (@misilva73), Kevaundray Wedderburn (@kevaundray)",
  "type": "Standards Track",
  "category": "Core",
  "createdDate": "2026-07-23",
  "discussionLink": "https://sila-magicians.org/t/sip-8347-offline-state-migration-to-the-pbt/29089",
  "requires": [
    7523,
    7928,
    8159,
    8297
  ],
  "forkRelationships": [],
  "tradeoffs": null
}
