{
  "id": 86,
  "title": "SIP-86: Abstraction of transaction origin and signature",
  "status": "Stagnant",
  "description": "",
  "author": "Vitalik Buterin (@vbuterin)",
  "type": "Standards Track",
  "category": "Core",
  "createdDate": "2017-02-10",
  "forkRelationships": [],
  "tradeoffs": null
}
