{
  "id": 8101,
  "title": "SIP-8101: Payload Chunking with Chunk Access Lists",
  "status": "Draft",
  "description": "Semantic payload chunking with separated state diffs for streaming validation and reduced latency",
  "author": "Toni Wahrstätter (@nerolation), Milos Stankovic (@morph-dev), Jihoon Song (@jihoonsong), Bharath Vedartham (@bharath-123), Raúl Kripalani (@raulk)",
  "type": "Standards Track",
  "category": "Core",
  "createdDate": "2025-12-01",
  "discussionLink": "https://sila-magicians.org/t/sip-8101-payload-chunking/27085",
  "forkRelationships": [],
  "tradeoffs": null,
  "requires": [
    4844,
    4895,
    7732,
    7825,
    7928
  ]
}
