{
  "id": 1276,
  "title": "SIP-1276: Eliminate Difficulty Bomb and Adjust Block Reward on Constantinople Shift",
  "status": "Stagnant",
  "description": "",
  "author": "EOS Classic (@eosclassicteam)",
  "type": "Standards Track",
  "category": "Core",
  "createdDate": "2018-07-31",
  "discussionLink": "https://sila-magicians.org/t/sip-1276-eliminate-difficulty-bomb-and-adjust-block-reward-on-constantinople-shift/908",
  "forkRelationships": [],
  "tradeoffs": null
}
