{
  "id": 1962,
  "title": "SIP-1962: EC arithmetic and pairings with runtime definitions",
  "status": "Stagnant",
  "description": "",
  "author": "Alex Vlasov (@shamatar)",
  "type": "Standards Track",
  "category": "Core",
  "createdDate": "2019-04-22",
  "discussionLink": "https://sila-magicians.org/t/generalised-precompile-for-elliptic-curve-arithmetics-and-pairings-working-group/3208/2",
  "forkRelationships": [],
  "tradeoffs": null,
  "requires": [
    1109
  ]
}
