{
  "id": 8337,
  "title": "SIP-8337: Validated EVM Code",
  "status": "Draft",
  "description": "Code prefixed with MAGIC bytes is proven at CREATE time to have fully static control flow and to never underflow the data stack.",
  "author": "Greg Colvin (@gcolvin) <greg@colvin.org>, Martin Holst Swende (@holiman), Brooklyn Zelenka (@expede), John Max Skaller",
  "type": "Standards Track",
  "category": "Core",
  "createdDate": "2026-07-09",
  "discussionLink": "https://sila-magicians.org/t/sip-8337-validated-evm-code/29013",
  "requires": [
    3541,
    7979
  ],
  "forkRelationships": [],
  "tradeoffs": null
}
