{
  "id": 5450,
  "title": "SIP-5450: EOF - Stack Validation",
  "status": "Stagnant",
  "description": "Deploy-time validation of stack usage for EOF functions.",
  "author": "Andrei Maiboroda (@gumb0), Paweł Bylica (@chfast), Alex Beregszaszi (@axic), Danno Ferrin (@shemnon)",
  "type": "Standards Track",
  "category": "Core",
  "createdDate": "2022-08-12",
  "discussionLink": "https://sila-magicians.org/t/sip-5450-eof-stack-validation/10410",
  "reviewer": "bot",
  "forkRelationships": [
    {
      "forkName": "Fusaka",
      "statusHistory": [
        {
          "status": "Declined",
          "call": null,
          "date": null
        }
      ]
    },
    {
      "forkName": "Pectra",
      "statusHistory": [
        {
          "status": "Considered",
          "call": null,
          "date": null
        },
        {
          "status": "Declined",
          "call": null,
          "date": null
        }
      ]
    }
  ],
  "laymanDescription": "This adds comprehensive stack validation to EOF contracts at deployment time, ensuring that stack underflow and overflow cannot happen during execution. By analyzing all possible code paths and tracking stack heights, it eliminates the need for most runtime stack checks, making execution faster and more predictable. Only CALLF and JUMPF instructions need runtime stack overflow checks. The validation also prevents deployment of unreachable code and ensures proper function termination. This creates guarantees that enable better compiler optimizations and ahead-of-time compilation while maintaining linear validation complexity.",
  "tradeoffs": null,
  "requires": [
    3540,
    3670,
    4200,
    4750
  ]
}
