{
  "id": 7863,
  "title": "SIP-7863: Block-level Warming",
  "status": "Draft",
  "description": "Warm addresses and storage keys over the duration of a block",
  "author": "Toni Wahrstätter (@nerolation), Jochem Brouwer (@jochem-brouwer), Alex Stokes (@ralexstokes), Ansgar Dietrichs (@adietrichs), Yoav Weiss (@yoavw), Alex Forshtat (@forshtat)",
  "type": "Standards Track",
  "category": "Core",
  "createdDate": "2025-01-15",
  "discussionLink": "https://sila-magicians.org/t/sip-7863-block-level-warming/22572",
  "forkRelationships": [],
  "tradeoffs": null
}
