{
  "id": 7960,
  "title": "SIP-7960: EOF - Extended types section",
  "status": "Draft",
  "description": "Extend EOF container's types section with an extra type parameter.",
  "author": "Wei Tang (@sorpaas)",
  "type": "Standards Track",
  "category": "Core",
  "createdDate": "2025-05-28",
  "discussionLink": "https://sila-magicians.org/t/sip-series-evm64/23794",
  "forkRelationships": [],
  "tradeoffs": null,
  "requires": [
    3540
  ]
}
