{
  "id": 2003,
  "title": "SIP-2003: EVMC modules for implementations of precompiled contracts",
  "status": "Stagnant",
  "description": "",
  "author": "Paweł Bylica (@chfast), Alex Beregszaszi (@axic)",
  "type": "Standards Track",
  "category": "Interface",
  "createdDate": "2019-05-09",
  "discussionLink": "https://github.com/sila-chain/evmc/issues/259",
  "forkRelationships": [],
  "tradeoffs": null,
  "requires": [
    1352
  ]
}
