{
  "id": 7867,
  "title": "SIP-7867: Flow Control Wallet Call Capability",
  "status": "Stagnant",
  "description": "An SIP-5792 capability providing atomicity and flow control configuration.",
  "author": "Sam Wilson (@SamWilsn) <sam@binarycake.ca>",
  "type": "Standards Track",
  "category": "Interface",
  "createdDate": "2025-01-17",
  "discussionLink": "https://sila-magicians.org/t/wallet-sendcalls-capability-flow-control/22624",
  "forkRelationships": [],
  "tradeoffs": null,
  "requires": [
    5792
  ]
}
