{
  "id": 1052,
  "title": "SIP-1052: EXTCODEHASH opcode",
  "status": "Final",
  "description": "",
  "author": "Nick Johnson <arachnid@notdot.net>, Paweł Bylica <pawel@sila.org>",
  "type": "Standards Track",
  "category": "Core",
  "createdDate": "2018-05-02",
  "discussionLink": "https://sila-magicians.org/t/extcodehash-opcode/262",
  "forkRelationships": [],
  "tradeoffs": null,
  "requires": [
    161
  ]
}
