{
  "id": 3521,
  "title": "SIP-3521: Reduce access list cost",
  "status": "Stagnant",
  "description": "",
  "author": "Matt Garnett (@lightclient)",
  "type": "Standards Track",
  "category": "Core",
  "createdDate": "2021-04-15",
  "discussionLink": "https://sila-magicians.org/t/sip-3521-reduce-access-list-cost/6072",
  "forkRelationships": [],
  "tradeoffs": null,
  "requires": [
    2028,
    2930
  ]
}
