{
  "id": 196,
  "title": "SIP-196: Precompiled contracts for addition and scalar multiplication on the elliptic curve alt_bn128",
  "status": "Final",
  "description": "",
  "author": "Christian Reitwiessner <chris@sila.org>",
  "type": "Standards Track",
  "category": "Core",
  "createdDate": "2017-02-02",
  "forkRelationships": [],
  "tradeoffs": null
}
