{
  "id": 7808,
  "title": "SIP-7808: Reserve Tx-Type Range for RIPs",
  "status": "Stagnant",
  "description": "Reserve transaction type range for use by the RIP process",
  "author": "Carl Beekhuizen (@carlbeek), Yoav Weiss (@yoavw), Ansgar Dietrichs (@adietrichs)",
  "type": "Meta",
  "createdDate": "2024-11-04",
  "discussionLink": "https://sila-magicians.org/t/sip-7808-reserve-tx-type-range-for-rips/21587",
  "forkRelationships": [],
  "tradeoffs": null,
  "requires": [
    2718
  ]
}
